{
  "comparison_policy": {
    "components_alignment": "first-k-prefix",
    "sign_resolver": "max_abs_element_positive",
    "tolerance_table_row": "pls4all-numpy-power"
  },
  "data": {
    "X": {
      "dtype": "f64",
      "layout": "row_major",
      "rng_seed": 80,
      "shape": [
        10,
        5
      ],
      "values": [
        0.9642790789793975,
        -0.41124328049961245,
        -0.5803245243874833,
        -1.199449423161406,
        -1.1774729435226259,
        2.553044580868376,
        0.13305763868547485,
        0.1121359670722826,
        0.8668567773618027,
        0.29078254332267023,
        -0.9268145298857623,
        -0.986096859243641,
        0.42452900584851144,
        -0.6727261760390335,
        0.9284677226670542,
        -0.5103047758078024,
        -0.9181188221182595,
        -0.2558360711256883,
        -0.8250130269329566,
        -0.052469915271798936,
        -2.0846654831112725,
        -0.5128265007800489,
        1.3393962364849485,
        -0.42900908973966945,
        1.7086339537259454,
        2.046053486185883,
        -0.45804116172367365,
        0.8983644639684912,
        -0.462375868470988,
        -0.12596939753999425,
        -0.8506500979602034,
        0.3673062573411947,
        0.8488489541262088,
        0.610777904760767,
        0.2991177068131999,
        -0.8067022608218128,
        -0.23694809101537936,
        0.29851940845789277,
        0.2543066355706877,
        -0.8420636067068412,
        0.7600481780418307,
        1.399115872324709,
        -0.015362007073571611,
        0.9999464961874844,
        0.12343723895304569,
        -1.1826200930383368,
        -0.22252067034325612,
        1.448460208275824,
        -0.188016722004804,
        -0.26998865291850854
      ]
    },
    "Y": {
      "dtype": "f64",
      "layout": "row_major",
      "rng_seed": 80,
      "shape": [
        10,
        1
      ],
      "values": [
        0.06842186727401242,
        1.113988608682174,
        -0.0949215282152214,
        -0.10692653338067898,
        -0.5835726854345304,
        1.0285796884555611,
        -0.05508332731294148,
        0.17072933424661219,
        -0.01919138683672043,
        0.037534069295564736
      ]
    }
  },
  "expected": {
    "coefficients": {
      "shape": [
        5,
        1
      ],
      "values": [
        0.3699383017939757,
        -0.2614213777768244,
        0.25516709664716386,
        0.13017038472409653,
        -0.08342424515071356
      ]
    },
    "intercept": {
      "shape": [
        1
      ],
      "values": [
        0.15595581067738318
      ]
    },
    "loadings_P": {
      "shape": [
        5,
        2
      ],
      "sign_invariant": true,
      "values": [
        0.7441885305149942,
        0.37795648001086624,
        0.3943154875777786,
        -0.6416144317431678,
        -0.43882937513394404,
        0.5571437010463169,
        0.3218460583101444,
        -0.3402205754794399,
        -0.4561692177232612,
        0.29900077316231144
      ]
    },
    "predict_train": {
      "shape": [
        10,
        1
      ],
      "values": [
        0.27301378972274776,
        1.0416440057719392,
        -0.1270123387211166,
        -0.10229637707671208,
        -0.4789847602299919,
        1.0709745780255653,
        -0.12479494629017829,
        -0.04219775873705839,
        0.04612298131163889,
        0.003088932996997834
      ]
    },
    "rotations_R": {
      "shape": [
        5,
        2
      ],
      "sign_invariant": true,
      "values": [
        0.8861147070833579,
        0.7166093572014788,
        0.10261669660581946,
        -0.5838088618136059,
        -0.13760777594176357,
        0.5882461874229696,
        0.2729483767009287,
        0.02031936090566737,
        -0.3329171415307016,
        0.11286949196375201
      ]
    },
    "scores_T": {
      "shape": [
        10,
        2
      ],
      "sign_invariant": true,
      "values": [
        0.8620745852945978,
        -0.45627855080434354,
        1.890309032594597,
        0.7048068191155077,
        -1.2021940803047895,
        0.31170616348490776,
        -0.4659073627877573,
        -0.2820375240348823,
        -2.2277322281136342,
        0.2778020320972359,
        1.0299339014783497,
        1.5564342563327072,
        -0.32316476207176664,
        -0.47113204408188114,
        0.05881187650874066,
        -0.5899925030589478,
        1.165783782129474,
        -1.343953907407232,
        -0.7879147447278124,
        0.2926452583569274
      ]
    },
    "weights_W": {
      "shape": [
        5,
        2
      ],
      "sign_invariant": true,
      "values": [
        0.8861147070833579,
        0.3071248942142987,
        0.10261669660581947,
        -0.6312292945942115,
        -0.13760777594176357,
        0.6518364266819965,
        0.2729483767009287,
        -0.10581342818265112,
        -0.3329171415307016,
        0.266714582028488
      ]
    },
    "x_mean": {
      "shape": [
        5
      ],
      "values": [
        -0.003833191654970336,
        -0.1846315617372492,
        0.45187316416474166,
        -0.10447024924681154,
        0.08824746495221465
      ]
    },
    "x_scale": {
      "shape": [
        5
      ],
      "values": [
        1.5073863571125765,
        0.6937945665833758,
        0.6718222958399054,
        0.7516641761669344,
        0.8219149520373785
      ]
    },
    "y_loadings_Q": {
      "shape": [
        1,
        2
      ],
      "sign_invariant": true,
      "values": [
        0.6337362004286727,
        0.7061835019502058
      ]
    },
    "y_mean": {
      "shape": [
        1
      ],
      "values": [
        0.15595581067738318
      ]
    },
    "y_scale": {
      "shape": [
        1
      ],
      "values": [
        0.522320298955578
      ]
    }
  },
  "fixture_id": "synthetic_power_tiny_pls1_v1",
  "generator": {
    "git_revision_sha": "unknown",
    "name": "pls4all_parity.suites._power_pls_expected",
    "params": {
      "algorithm": "power",
      "deflation_mode": "regression",
      "n_components": 2,
      "reference": "NumPy singular-pair power iteration with regression deflation",
      "scale": true
    },
    "version": "1"
  },
  "schema_version": 1
}
