{
  "comparison_policy": {
    "components_alignment": "first-k-prefix",
    "sign_resolver": "max_abs_element_positive",
    "tolerance_table_row": "sklearn/PLSCanonical/svd"
  },
  "data": {
    "X": {
      "dtype": "f64",
      "layout": "row_major",
      "rng_seed": 102,
      "shape": [
        9,
        4
      ],
      "values": [
        0.6257293982571508,
        2.164325358952666,
        0.9555405586957074,
        -1.0802324230246478,
        -0.5936751273756264,
        0.8612190556690689,
        -0.04393442340863364,
        1.1924864710821501,
        -1.942232859371308,
        2.1129201593831803,
        1.8849826072080755,
        -1.4481993417672274,
        -0.2959681857860406,
        -0.6036165972136037,
        -0.36899399285040124,
        0.9958378280721536,
        -0.4863540769292705,
        -0.8890433114118423,
        0.7570265703060689,
        1.4062239157918979,
        -0.3881492789262264,
        0.36029010775778963,
        -1.3893371328040796,
        1.0793264421140967,
        2.3906730141718127,
        0.6863955531246578,
        0.01735527512890846,
        -2.000952600015396,
        -0.24252450183674057,
        -2.0222524596711384,
        0.8765379207703655,
        1.909386144303365,
        1.5110178374701178,
        0.2511808880888286,
        0.5859535803285394,
        -0.6161660912785262
      ]
    },
    "Y": {
      "dtype": "f64",
      "layout": "row_major",
      "rng_seed": 102,
      "shape": [
        9,
        1
      ],
      "values": [
        -0.7172056463670298,
        -0.33747520174668527,
        -1.4198931440158495,
        0.21679544125423877,
        0.7595021890696764,
        -0.43650734660335233,
        0.07428302478444655,
        1.5027485311428783,
        0.4661307976956721
      ]
    }
  },
  "expected": {
    "coefficients": {
      "shape": [
        4,
        1
      ],
      "values": [
        0.18612784768754612,
        -0.5155778401919965,
        -0.08670132876013141,
        0.29915408287798245
      ]
    },
    "intercept": {
      "shape": [
        1
      ],
      "values": [
        0.012042071690443912
      ]
    },
    "loadings_P": {
      "shape": [
        4,
        1
      ],
      "sign_invariant": true,
      "values": [
        -0.07104419204618805,
        0.7680020028220735,
        0.3329598435646729,
        -0.6451226810108187
      ]
    },
    "predict_train": {
      "shape": [
        9,
        1
      ],
      "values": [
        -1.254217245522816,
        -0.042780706534827614,
        -1.8963458184268132,
        0.7372225000423077,
        0.8740872673939548,
        0.3365371602726447,
        -0.3578195211850423,
        1.6438895086758536,
        0.06780550049873388
      ]
    },
    "rotations_R": {
      "shape": [
        4,
        1
      ],
      "sign_invariant": true,
      "values": [
        -0.2755062131040473,
        0.8153151734863173,
        0.09431844089485444,
        -0.5004613133212271
      ]
    },
    "scores_T": {
      "shape": [
        9,
        1
      ],
      "sign_invariant": true,
      "values": [
        1.46970238084254,
        0.06363085869283605,
        2.214998292647536,
        -0.8416912614982546,
        -1.0005453537807592,
        -0.376629966530506,
        0.4292852626961302,
        -1.894027574531429,
        -0.06472263853809371
      ]
    },
    "weights_W": {
      "shape": [
        4,
        1
      ],
      "sign_invariant": true,
      "values": [
        -0.2755062131040473,
        0.8153151734863173,
        0.09431844089485444,
        -0.5004613133212271
      ]
    },
    "x_mean": {
      "shape": [
        4
      ],
      "values": [
        0.06427957996376318,
        0.3246020838532897,
        0.3639034403749501,
        0.15974559391976284
      ]
    },
    "x_scale": {
      "shape": [
        4
      ],
      "values": [
        1.275302755958072,
        1.362462438834839,
        0.9372687042025066,
        1.441347944173718
      ]
    },
    "y_loadings_Q": {
      "shape": [
        1,
        1
      ],
      "sign_invariant": true,
      "values": [
        -1.0
      ]
    },
    "y_mean": {
      "shape": [
        1
      ],
      "values": [
        0.012042071690443912
      ]
    },
    "y_scale": {
      "shape": [
        1
      ],
      "values": [
        0.8615753323386113
      ]
    }
  },
  "fixture_id": "synthetic_canonical_svd_tiny_pls1_v1",
  "generator": {
    "git_revision_sha": "unknown",
    "name": "pls4all_parity.suites._canonical_pls_expected",
    "params": {
      "algorithm": "svd",
      "deflation_mode": "canonical",
      "n_components": 1,
      "reference": "NumPy mirror of sklearn PLSCanonical(svd)",
      "scale": true
    },
    "version": "1"
  },
  "schema_version": 1
}
