{
  "comparison_policy": {
    "components_alignment": "exact",
    "sign_resolver": "none",
    "tolerance_table_row": "pls4all-numpy-preprocessing"
  },
  "data": {
    "X": {
      "dtype": "f64",
      "layout": "row_major",
      "rng_seed": 52,
      "shape": [
        3,
        9
      ],
      "values": [
        0.52,
        0.57,
        0.74,
        0.75,
        0.93,
        0.98,
        1.11,
        1.1900000000000002,
        1.32,
        -0.01,
        0.32743851458038087,
        0.5450972729404622,
        0.836081108260693,
        0.9289846193555862,
        1.0399655856782488,
        0.9240857816096938,
        0.825789313258297,
        0.5984721441039565,
        1.0,
        0.983125,
        0.8925,
        0.8881249999999999,
        0.81,
        0.848125,
        0.8025,
        0.8331249999999999,
        0.78
      ]
    },
    "Y": {
      "dtype": "f64",
      "layout": "row_major",
      "rng_seed": 52,
      "shape": [
        3,
        1
      ],
      "values": [
        0.0,
        0.0,
        0.0
      ]
    }
  },
  "expected": {
    "transform_train": {
      "shape": [
        3,
        9
      ],
      "values": [
        0.5562132034355963,
        0.5637867965644033,
        0.7299999999999998,
        0.7299999999999998,
        0.9662132034355964,
        0.9737867965644034,
        1.1162132034355963,
        1.1537867965644033,
        1.3199999999999996,
        0.026213203435596365,
        0.3212253111447843,
        0.5513104763760585,
        0.7998679048250964,
        0.9351978227911822,
        1.0037523822426522,
        0.9178725781740972,
        0.8620025166938934,
        0.5984721441039563,
        0.9765624999999997,
        0.9765624999999997,
        0.9053124999999995,
        0.9053124999999995,
        0.8234374999999996,
        0.8234374999999996,
        0.8234374999999996,
        0.8234374999999996,
        0.7799999999999997
      ]
    }
  },
  "fixture_id": "synthetic_pipeline_wavelet_haar_v1",
  "generator": {
    "git_revision_sha": "unknown",
    "name": "pls4all_parity.suites._pipeline_expected",
    "params": {
      "operators": [
        "wavelet_haar_2_0.03"
      ],
      "reference": "NumPy/SciPy preprocessing pipeline"
    },
    "version": "1"
  },
  "schema_version": 1
}
