{
  "comparison_policy": {
    "components_alignment": "first-k-prefix",
    "sign_resolver": "max_abs_element_positive",
    "tolerance_table_row": "pls4all-numpy-simpls"
  },
  "data": {
    "X": {
      "dtype": "f64",
      "layout": "row_major",
      "rng_seed": 20,
      "shape": [
        8,
        4
      ],
      "values": [
        -0.35966845567139044,
        1.2036751014877107,
        1.3968681196180939,
        0.31723592758455404,
        0.41413419203577684,
        -0.4895498035052234,
        -0.9141207048308895,
        -0.9003606290309881,
        -0.9984312679885344,
        0.9292048240939573,
        -0.05629191668093178,
        0.1282790949733999,
        -0.6399704392204456,
        -1.0878172085644096,
        -1.2019541755133116,
        -0.8415691844772564,
        0.5991567147195185,
        0.01844008196322814,
        -0.45677163924420827,
        -0.23927840186540572,
        -1.427335350087018,
        1.2306824377006564,
        -1.2164154219415413,
        0.04238178066477212,
        2.1369751648960755,
        -2.5511902614867554,
        -1.406959579319153,
        -0.7237059839987247,
        0.1165516397529902,
        -1.7148763387690875,
        -0.23527948055323214,
        -0.028427676959011872
      ]
    },
    "Y": {
      "dtype": "f64",
      "layout": "row_major",
      "rng_seed": 20,
      "shape": [
        8,
        1
      ],
      "values": [
        -0.020547373552374775,
        0.06501796744290284,
        -0.9471547009995823,
        -0.5247437103994139,
        0.26911683948076065,
        -1.8193031916954523,
        1.6248639466005865,
        0.3396469611401576
      ]
    }
  },
  "expected": {
    "coefficients": {
      "shape": [
        4,
        1
      ],
      "values": [
        0.6544460333481255,
        -0.2952413317218434,
        0.39353606839712846,
        -0.021333135041413907
      ]
    },
    "intercept": {
      "shape": [
        1
      ],
      "values": [
        -0.12663790774780195
      ]
    },
    "loadings_P": {
      "shape": [
        4,
        2
      ],
      "sign_invariant": true,
      "values": [
        2.4274939249273833,
        0.8129044270506453,
        -2.4598024779854666,
        0.17947485658084483,
        -1.306530204760811,
        2.186888082188537,
        -1.9633622057567082,
        1.4325970951297795
      ]
    },
    "predict_train": {
      "shape": [
        8,
        1
      ],
      "values": [
        -0.057058913289952634,
        0.06578083163587098,
        -0.9618995776552606,
        -0.5619675558596118,
        0.2027688741298578,
        -1.786320789106512,
        1.6042502763424742,
        0.48134359182071806
      ]
    },
    "rotations_R": {
      "shape": [
        4,
        2
      ],
      "sign_invariant": true,
      "values": [
        0.1904179739220116,
        0.21889412521528032,
        -0.15171626182599132,
        -0.0473686792462632,
        -0.00606516011787239,
        0.29007519577153756,
        -0.07978414424351539,
        0.13695371543540058
      ]
    },
    "scores_T": {
      "shape": [
        8,
        2
      ],
      "sign_invariant": true,
      "values": [
        -0.33334226513236054,
        0.6589979221865757,
        0.2001827478051666,
        -0.21432587081066767,
        -0.37179391877655166,
        0.027869797738602053,
        0.07631523546960667,
        -0.47575569471027673,
        0.06348933653323538,
        0.13992333936764556,
        -0.4554741372516325,
        -0.4588609588732137,
        0.690093940994296,
        0.08812626624532172,
        0.13052906035824,
        0.2340251988560128
      ]
    },
    "weights_W": {
      "shape": [
        4,
        2
      ],
      "sign_invariant": true,
      "values": [
        0.19041797392201154,
        0.2188941252152803,
        -0.1517162618259913,
        -0.047368679246263215,
        -0.006065160117872384,
        0.2900751957715375,
        -0.07978414424351538,
        0.13695371543540052
      ]
    },
    "x_mean": {
      "shape": [
        4
      ],
      "values": [
        -0.019823475195378387,
        -0.3076788958849904,
        -0.5113655998081467,
        -0.2806806341385826
      ]
    },
    "x_scale": {
      "shape": [
        4
      ],
      "values": [
        1.1135961076077572,
        1.4112923220175753,
        0.9154202870928919,
        0.4764958432601411
      ]
    },
    "y_loadings_Q": {
      "shape": [
        1,
        2
      ],
      "sign_invariant": true,
      "values": [
        2.312710271744449,
        1.2740459421153016
      ]
    },
    "y_mean": {
      "shape": [
        1
      ],
      "values": [
        -0.12663790774780195
      ]
    },
    "y_scale": {
      "shape": [
        1
      ],
      "values": [
        1.013243809485815
      ]
    }
  },
  "fixture_id": "synthetic_simpls_tiny_pls1_v1",
  "generator": {
    "git_revision_sha": "unknown",
    "name": "pls4all_parity.suites._simpls_expected",
    "params": {
      "algorithm": "simpls",
      "deflation_mode": "regression",
      "n_components": 2,
      "reference": "NumPy port of nirs4all AOM_v0 simpls_standard",
      "scale": true
    },
    "version": "1"
  },
  "schema_version": 1
}
