{
  "comparison_policy": {
    "components_alignment": "first-k-prefix",
    "sign_resolver": "max_abs_element_positive",
    "tolerance_table_row": "pls4all-numpy-svd"
  },
  "data": {
    "X": {
      "dtype": "f64",
      "layout": "row_major",
      "rng_seed": 30,
      "shape": [
        9,
        4
      ],
      "values": [
        1.5746411431681302,
        0.7432833867028191,
        -0.9698888175576575,
        -0.2120044493626771,
        -0.2867299190012126,
        2.3624189202137407,
        -0.943225489608639,
        1.3757948597156504,
        0.12317992062651277,
        1.0218538102952426,
        -0.0027781216332353766,
        0.3927701046524877,
        0.491156064712792,
        0.10953869409072106,
        0.6512592984651386,
        0.3496303616197618,
        1.2328190417642915,
        1.8074424397926976,
        -0.08832984255347656,
        -0.1872296676125356,
        0.4106914898142733,
        -1.6574989126064583,
        0.3081900463490193,
        -0.524235693173715,
        -0.822935739443747,
        -1.5787501417612935,
        -0.22460757394585165,
        0.5098854894376852,
        -0.5283039225093467,
        -0.9098222824092372,
        -0.5625451549455628,
        -0.15138536455592896,
        -1.1588554465764798,
        -0.534120971120513,
        -1.0754254370007643,
        -0.12611617018133786
      ]
    },
    "Y": {
      "dtype": "f64",
      "layout": "row_major",
      "rng_seed": 30,
      "shape": [
        9,
        1
      ],
      "values": [
        0.07521825076779814,
        -1.1313401933527187,
        -0.3198796098550351,
        0.3960680266849915,
        -0.5509228972818866,
        0.9674922709476295,
        0.6336592635428763,
        0.10652464208975276,
        -0.4772802205222556
      ]
    }
  },
  "expected": {
    "coefficients": {
      "shape": [
        4,
        1
      ],
      "values": [
        0.14244794533741836,
        -0.36255925429875224,
        0.48803323853527253,
        0.06446287521711891
      ]
    },
    "intercept": {
      "shape": [
        1
      ],
      "values": [
        -0.033384496330983095
      ]
    },
    "loadings_P": {
      "shape": [
        4,
        2
      ],
      "sign_invariant": true,
      "values": [
        -0.014133641570395167,
        -0.32853993319255825,
        0.6684886446824444,
        -0.1906534822212231,
        -0.4858622865118253,
        0.7701222612537534,
        0.5825802550378946,
        1.1107631384833565
      ]
    },
    "predict_train": {
      "shape": [
        9,
        1
      ],
      "values": [
        -0.37956696153960173,
        -1.1163813174744532,
        -0.1763552439108838,
        0.5232415783458302,
        -0.3822523951034133,
        0.9286742853823371,
        0.5310350022653392,
        0.12292652072855972,
        -0.35178193567256194
      ]
    },
    "rotations_R": {
      "shape": [
        4,
        2
      ],
      "sign_invariant": true,
      "values": [
        -0.05979780874915012,
        0.3131434114825059,
        0.7328626945010401,
        -0.5388153290874554,
        -0.5015456149298618,
        0.17976220692692008,
        0.45583822703027227,
        0.7757857544800417
      ]
    },
    "scores_T": {
      "shape": [
        9,
        2
      ],
      "sign_invariant": true,
      "values": [
        0.4440634636470431,
        -0.4177454988974313,
        2.6378566571303277,
        0.5091113939532382,
        0.3646837813715543,
        0.09113371625668505,
        -0.6989820519551209,
        0.6935463390964306,
        0.2984512467118767,
        -0.6377686044778215,
        -2.008078323578257,
        0.03525631781493381,
        -0.6192344979915076,
        0.8334717175879498,
        -0.5477805027593027,
        -0.3164371552916636,
        0.1290202274233856,
        -0.7905682260423215
      ]
    },
    "weights_W": {
      "shape": [
        4,
        2
      ],
      "sign_invariant": true,
      "values": [
        -0.059797808749150104,
        0.3041660210216224,
        0.73286269450104,
        -0.42879132151302163,
        -0.5015456149298617,
        0.10446562142731687,
        0.45583822703027216,
        0.8442203315431316
      ]
    },
    "x_mean": {
      "shape": [
        4
      ],
      "values": [
        0.1150736258394682,
        0.15159388257752432,
        -0.3230390102701144,
        0.15856771894882116
      ]
    },
    "x_scale": {
      "shape": [
        4
      ],
      "values": [
        0.9142430883030006,
        1.4405951704704236,
        0.6063771480059144,
        0.5697211679590126
      ]
    },
    "y_loadings_Q": {
      "shape": [
        1,
        2
      ],
      "sign_invariant": true,
      "values": [
        -0.724537162726001,
        0.4981826210765849
      ]
    },
    "y_mean": {
      "shape": [
        1
      ],
      "values": [
        -0.033384496330983095
      ]
    },
    "y_scale": {
      "shape": [
        1
      ],
      "values": [
        0.6533544068105686
      ]
    }
  },
  "fixture_id": "synthetic_svd_tiny_pls1_v1",
  "generator": {
    "git_revision_sha": "unknown",
    "name": "pls4all_parity.suites._svd_pls_expected",
    "params": {
      "algorithm": "svd",
      "deflation_mode": "regression",
      "n_components": 2,
      "reference": "NumPy SVD with regression deflation",
      "scale": true
    },
    "version": "1"
  },
  "schema_version": 1
}
