{
  "comparison_policy": {
    "components_alignment": "first-k-prefix",
    "sign_resolver": "max_abs_element_positive",
    "tolerance_table_row": "sklearn/PLSDA-dummy/PLSRegression"
  },
  "data": {
    "X": {
      "dtype": "f64",
      "layout": "row_major",
      "rng_seed": 110,
      "shape": [
        18,
        6
      ],
      "values": [
        0.25186555969015784,
        0.13608411110288918,
        1.2385828513765138,
        -0.03173910250755441,
        -1.3180320353880222,
        -0.00925722538736264,
        0.5201656335272244,
        1.2079370503495324,
        1.87635542552518,
        -1.354632695121431,
        -0.5708927140606489,
        -0.15912195664410528,
        0.8949550530856945,
        -0.18122863903243455,
        -0.6080449304501043,
        -0.22318499227882305,
        -1.206280544871409,
        -0.626448082957318,
        0.3902371429562821,
        -0.08107776920683742,
        -1.3598757929360714,
        -1.776070945622174,
        1.2739706742913528,
        1.340816544538391,
        -0.10904935935324919,
        -0.21742731194807746,
        0.8172789185734416,
        0.876178100440829,
        1.3072015577571992,
        1.7470745204424993,
        0.25669337648937374,
        -2.114720217016758,
        0.6914567117611404,
        -0.3179698045900685,
        -1.7335851818525805,
        0.7291957454605545,
        1.7067533109951951,
        -0.5150088109304464,
        0.5575177179088303,
        1.0086428154967941,
        0.33628822707032896,
        0.6233792176239852,
        -0.2701887520996612,
        -0.23355876995352323,
        -0.06738263939548982,
        0.44112359141817215,
        0.11963189310006936,
        -0.9676162937492392,
        -0.679852945902293,
        0.2600813535590736,
        0.13722513314328807,
        -0.3468048484515875,
        0.4233645893712507,
        -0.44467314985424045,
        1.6971781339635656,
        -0.011516146254151927,
        2.828819834987609,
        0.5955193190511678,
        -1.1667206227656608,
        0.9226583331285789,
        -0.3613244215547774,
        -0.39559034648322383,
        -0.11507553096741527,
        1.792262092755632,
        0.04937405475788769,
        -0.9274402027072406,
        -1.5693114099671392,
        -0.7950993533412329,
        -0.2187617721386749,
        -0.5570419458093259,
        0.03223668146664688,
        -0.5690564128521177,
        -0.03949970973685796,
        -2.498060877114987,
        1.5940066805859392,
        -1.4355860997203442,
        -0.22265302036236337,
        -0.20034396545784156,
        0.1266633713511832,
        0.6963735661579484,
        0.0729982591619781,
        1.1620502412936162,
        -1.4451183046261329,
        1.4489024375807835,
        -0.1712918667347412,
        1.3820222924486045,
        0.4312998470096277,
        0.8255252350572004,
        0.7815367289116472,
        1.766710328232811,
        -1.1227890579027207,
        -0.0022155090059591677,
        0.8487660994115866,
        -0.0855641205543251,
        2.0495523084955805,
        -0.8174969852187495,
        1.8304199004277066,
        -0.493244330429435,
        -1.9330122273351493,
        1.0233400593322473,
        -1.8089289538412006,
        -0.01918995006310294,
        1.3118803566062573,
        1.1665674108284054,
        0.7180886147423081,
        -0.34358400837279796,
        0.03745470141689462,
        -1.4422040821175004
      ]
    },
    "Y": {
      "dtype": "f64",
      "layout": "row_major",
      "rng_seed": 110,
      "shape": [
        18,
        2
      ],
      "values": [
        1.0,
        0.0,
        0.0,
        1.0,
        1.0,
        0.0,
        0.0,
        1.0,
        0.0,
        1.0,
        1.0,
        0.0,
        1.0,
        0.0,
        1.0,
        0.0,
        0.0,
        1.0,
        1.0,
        0.0,
        1.0,
        0.0,
        0.0,
        1.0,
        1.0,
        0.0,
        0.0,
        1.0,
        0.0,
        1.0,
        1.0,
        0.0,
        1.0,
        0.0,
        1.0,
        0.0
      ]
    }
  },
  "expected": {
    "coefficients": {
      "shape": [
        6,
        2
      ],
      "values": [
        0.20914356755517607,
        -0.2091435675551761,
        -0.23278882310619434,
        0.23278882310619434,
        0.08563420667275094,
        -0.08563420667275094,
        0.15274154570454218,
        -0.15274154570454218,
        -0.004346015084548024,
        0.004346015084548018,
        -0.3297036967913615,
        0.3297036967913615
      ]
    },
    "intercept": {
      "shape": [
        2
      ],
      "values": [
        0.6111111111111112,
        0.3888888888888889
      ]
    },
    "loadings_P": {
      "shape": [
        6,
        2
      ],
      "sign_invariant": true,
      "values": [
        -0.5018310488203449,
        -0.4158583550964792,
        0.4471455689312872,
        -0.11356224519304546,
        -0.08406587745148571,
        0.162618132278473,
        -0.1501917847540538,
        0.10197934217587572,
        0.6591830392749181,
        0.755569108414833,
        0.44499394797196984,
        -0.6504198203262339
      ]
    },
    "predict_train": {
      "shape": [
        18,
        2
      ],
      "values": [
        0.6499236492911574,
        0.3500763507088426,
        0.3552397130782425,
        0.6447602869217575,
        0.8739167293218526,
        0.1260832706781475,
        -0.21592204787314473,
        1.2159220478731447,
        0.1688543983731391,
        0.831145601626861,
        0.8426587397731272,
        0.15734126022687284,
        0.9905860141253018,
        0.009413985874698105,
        0.8969049579212727,
        0.10309504207872733,
        0.4197481253758998,
        0.5802518746241003,
        0.9106346644638321,
        0.08936533553616788,
        1.104913634993871,
        -0.10491363499387113,
        0.45947075791546255,
        0.5405292420845376,
        1.0764381373262626,
        -0.07643813732626259,
        0.0956282993191836,
        0.9043717006808165,
        -0.26147647238046023,
        1.2614764723804601,
        0.6048591838096199,
        0.39514081619038016,
        1.0215344579690304,
        -0.021534457969030307,
        1.0060870571963503,
        -0.006087057196350332
      ]
    },
    "rotations_R": {
      "shape": [
        6,
        2
      ],
      "sign_invariant": true,
      "values": [
        -0.47657160495369216,
        0.08603513391119166,
        0.4802318048249756,
        -0.2601210429062033,
        -0.14266115781480748,
        0.22174514956407362,
        -0.23275325072372705,
        0.32315612019274803,
        0.3681512470786923,
        0.7379188213636036,
        0.5763638578097068,
        -0.5837380583858688
      ]
    },
    "scores_T": {
      "shape": [
        18,
        2
      ],
      "sign_invariant": true,
      "values": [
        -0.3999842291137047,
        -0.6209269107045964,
        0.3731604709095195,
        -0.6049425948769493,
        -0.9115809575320555,
        -0.47517082855860093,
        1.802848031059302,
        -0.7168303393637064,
        1.3243653696830648,
        0.3644613025630937,
        -1.055969948053648,
        -0.9433680124031355,
        -0.6908980453464303,
        0.6118400882601065,
        -0.3405863039035494,
        0.8338669518978932,
        0.6631998061800799,
        0.3448112286945776,
        -0.958255066209204,
        -0.37409154449319365,
        -0.6878903993777113,
        1.2344396646010287,
        0.49655677675957677,
        0.2130926480653612,
        -0.9780950264046437,
        0.4786015690727744,
        0.5930968926445477,
        -1.5480661392197146,
        2.021705304717023,
        -0.5081806552410424,
        0.9273553035786403,
        1.8910296723649427,
        -1.5055699998574459,
        -0.9121716354148762,
        -0.6734579797333614,
        0.7316055347560384
      ]
    },
    "weights_W": {
      "shape": [
        6,
        2
      ],
      "sign_invariant": true,
      "values": [
        -0.47657160495369216,
        -0.07483167899255369,
        0.4802318048249756,
        -0.09801872901632318,
        -0.14266115781480748,
        0.17358985549224923,
        -0.23275325072372705,
        0.24459022737051284,
        0.36815124707869223,
        0.8621883270758522,
        0.5763638578097068,
        -0.3891863563645862
      ]
    },
    "x_mean": {
      "shape": [
        6
      ],
      "values": [
        0.25908357310228897,
        -0.14942679423725636,
        0.4172357333869188,
        0.06958127176762376,
        -0.17008888672939781,
        0.13310493444437702
      ]
    },
    "x_scale": {
      "shape": [
        6
      ],
      "values": [
        0.9535619667363363,
        1.0014721979329124,
        1.1216743863480365,
        0.9790945426827332,
        1.1174807777133362,
        1.0014093751782804
      ]
    },
    "y_loadings_Q": {
      "shape": [
        2,
        2
      ],
      "sign_invariant": true,
      "values": [
        -0.7674653616145114,
        0.3697720305880381,
        0.7674653616145113,
        -0.36977203058803804
      ]
    },
    "y_mean": {
      "shape": [
        2
      ],
      "values": [
        0.6111111111111112,
        0.3888888888888889
      ]
    },
    "y_scale": {
      "shape": [
        2
      ],
      "values": [
        0.5016313257045503,
        0.5016313257045504
      ]
    }
  },
  "fixture_id": "synthetic_pls_da_binary_v1",
  "generator": {
    "git_revision_sha": "unknown",
    "name": "pls4all_parity.suites._expected_from_pls_da",
    "params": {
      "algorithm": "pls-da-dummy",
      "deflation_mode": "regression",
      "n_components": 2,
      "reference": "sklearn PLSRegression on dummy-coded class targets",
      "scale": true
    },
    "version": "1"
  },
  "schema_version": 1
}
