{
  "comparison_policy": {
    "components_alignment": "exact",
    "sign_resolver": "none",
    "tolerance_table_row": "sklearn/PLSRegression-block-weighted-MBPLS"
  },
  "data": {
    "X": {
      "dtype": "f64",
      "layout": "row_major",
      "rng_seed": 100,
      "shape": [
        20,
        7
      ],
      "values": [
        -0.9847507698500582,
        0.7676542942220485,
        0.06788963379512095,
        -0.14730866226074074,
        0.7882079301733211,
        -0.20609724244784972,
        1.186735885966892,
        0.36515877745123776,
        0.37361660529103036,
        -0.8190868997021873,
        -0.20221804608618,
        0.4399170486320079,
        0.45061398172642214,
        1.1534131091430482,
        0.649852248647736,
        0.16583391613303564,
        0.315105287315089,
        0.5005641247469036,
        0.18645272275110264,
        0.7957813089845447,
        1.0756597892386515,
        1.2189394651203693,
        -0.6565102874532511,
        1.4751707381982084,
        1.1990196812336749,
        -0.632576140375087,
        0.9797631589505539,
        0.7729589678644971,
        0.3349279400248716,
        -0.6745855631836384,
        1.3308119883231653,
        0.7098493923171104,
        -0.7506421819528089,
        0.9893764696683987,
        0.5312503278643746,
        0.12821790979750397,
        -0.09422528215764778,
        -0.3805576713409565,
        -0.10961457669199293,
        -0.16759312462570164,
        1.0682081116297935,
        0.6820102015570462,
        0.09254432617450917,
        -0.6598791114577149,
        -0.9429016612271177,
        -0.645610239040515,
        -0.6038401519364957,
        0.987966967333753,
        0.3053497846887537,
        -1.1617787704409508,
        0.1386147400920136,
        -0.010343039279458177,
        -0.45475561471427295,
        -0.0025370219582290035,
        0.5285428675089129,
        0.19250397290573434,
        1.1672256396646283,
        0.2688082343207738,
        -0.728817244008183,
        0.017590300981140936,
        0.5124121212971362,
        0.7128464644497183,
        0.6459271702013902,
        -0.263451819370013,
        0.11938140590907129,
        0.17405604911409803,
        0.0037783440980182405,
        0.14068504104262897,
        0.06504410740010583,
        0.11660413452310425,
        -0.17505776146757765,
        0.08188043984248386,
        -0.836487689132749,
        -0.40669212228670815,
        0.16970923748979505,
        -0.13332564264086372,
        -0.006622959212148091,
        0.3968255787595656,
        0.1714997521906714,
        0.037630722427400426,
        0.2215699662772419,
        0.20369585378159655,
        -0.4190799167566673,
        -0.09213547219848767,
        -0.6979074222698171,
        -0.10710828140866853,
        0.06431993859793514,
        -0.24800512064585695,
        -0.07445794419174545,
        -0.8475160654124868,
        -0.55472144302414,
        -1.3361475004307999,
        0.25860811048575444,
        0.3498297599026171,
        -0.2768189090895244,
        0.1419806858697223,
        -1.1265764001988785,
        -0.6410294174515835,
        0.32161557601403845,
        0.07415389856678517,
        1.3169622007412394,
        0.9161945044006121,
        0.15710052583871678,
        -0.9788080229061819,
        -0.5845861097056861,
        0.2632872863336017,
        0.6039515618071583,
        0.5032724048670868,
        0.48707465598077226,
        0.651495385420234,
        -0.9128754527034605,
        -0.5563568198831319,
        1.3606566145176702,
        0.25003020841666374,
        -0.5772224456634006,
        0.1973615849018195,
        0.4537337075529718,
        -0.470720974455192,
        -0.5276914035659843,
        -0.32482117509972747,
        -0.39947875641206093,
        -0.5764159322520347,
        -0.43219610107346557,
        -0.46454080566363704,
        -0.6288564413145417,
        -1.183383672047848,
        1.036141480216318,
        0.29162150299846906,
        0.21323787325432708,
        0.4695738618836073,
        0.3412677547328279,
        -0.1283562408072016,
        -0.6908854372819555,
        -0.8001380847274923,
        -0.2890692126549185,
        0.02055218319828841,
        -0.3220469437003334,
        -0.3146709471165291,
        -0.1401243667760664,
        -1.349658931031365
      ]
    },
    "Y": {
      "dtype": "f64",
      "layout": "row_major",
      "rng_seed": 100,
      "shape": [
        20,
        2
      ],
      "values": [
        -1.589149587749333,
        0.5094707842049667,
        0.024458801616011952,
        1.1597488863893948,
        0.2669622520610262,
        0.20397059720081742,
        1.538148441223828,
        -1.4086094214238785,
        0.7393219495515619,
        -1.7065786118276636,
        0.32185563832357716,
        0.266801125475235,
        1.0319831283062686,
        0.07270960683497021,
        -1.1389826630284232,
        -0.39973698255050444,
        0.7155430644990173,
        1.4863964779960188,
        -0.4617480211609755,
        -0.12922751323006565,
        -0.19788680429946515,
        0.7472737833204633,
        0.03420180998793196,
        0.3424683833452901,
        -0.4837996637746226,
        -0.370384566273731,
        -1.4547805135136975,
        -0.5982754990330577,
        -0.23158120424552625,
        -0.7607268771508344,
        -0.5586048688117444,
        0.4128965897657344,
        0.9344221847362103,
        1.4996048662405357,
        0.43153220457794067,
        -0.24875279792932312,
        0.5116996905038086,
        0.5665638318652683,
        -0.3377344233835241,
        -0.7204829343484784
      ]
    }
  },
  "expected": {
    "block_weights": {
      "dtype": "f64",
      "layout": "row_major",
      "shape": [
        3
      ],
      "values": [
        0.7071067811865475,
        0.5773502691896258,
        0.7071067811865475
      ]
    },
    "coefficients": {
      "dtype": "f64",
      "layout": "row_major",
      "shape": [
        7,
        2
      ],
      "values": [
        0.5275682132618443,
        0.39568226896672776,
        -0.5305648075390058,
        0.8153945822348923,
        -0.0821009338925776,
        -0.44442867148419657,
        0.19258984599430087,
        -0.20200066800978603,
        -0.21198308927647996,
        0.6177602170277283,
        0.333720861197255,
        0.0565576506671133,
        0.10637774560720131,
        0.16970778093353642
      ]
    },
    "intercept": {
      "dtype": "f64",
      "layout": "row_major",
      "shape": [
        2
      ],
      "values": [
        -0.028991037086040998,
        -0.01807816881831447
      ]
    },
    "predictions": {
      "dtype": "f64",
      "layout": "row_major",
      "shape": [
        20,
        2
      ],
      "values": [
        -1.0993719621192153,
        0.8944643530905363,
        0.1735517588221871,
        1.328919622475425,
        0.63686810515863,
        0.4758592400099501,
        1.6154985354696447,
        -1.1730814351484073,
        1.0788787637811306,
        -1.4880503446643278,
        0.5633397079339073,
        0.21972297214069267,
        0.8132076816639632,
        -0.23538673840380614,
        -0.6047831053956881,
        -0.20729474580491136,
        0.7053855164797368,
        1.4497947368416069,
        -0.24059409795430037,
        0.007279834733380688,
        -0.2556107522520612,
        0.5295057012836644,
        -0.06388455122020796,
        0.30379410496006876,
        -0.7194609019273751,
        -0.548122916842162,
        -1.427393025155308,
        -0.5202513372607027,
        -0.2524726629002896,
        -0.6582410027443582,
        -0.6599735504175918,
        0.5129204397132038,
        0.33218334768219004,
        1.1049722618229518,
        -0.2615926940541425,
        -0.6522281827942347,
        0.2471753114813774,
        0.5263814585107934,
        -0.4850900096567159,
        -0.9458282930482056
      ]
    },
    "x_mean": {
      "dtype": "f64",
      "layout": "row_major",
      "shape": [
        7
      ],
      "values": [
        0.0795669769532807,
        0.03423990877740292,
        0.04985030985642445,
        0.07386550406156556,
        0.05878998483809137,
        0.029290333561640673,
        0.02376708392755813
      ]
    },
    "x_scale": {
      "dtype": "f64",
      "layout": "row_major",
      "shape": [
        7
      ],
      "values": [
        0.7982630671339415,
        0.40029434923789103,
        0.7179799396403448,
        0.500566142987648,
        0.43537075107420303,
        0.737518703007174,
        0.7659391805938819
      ]
    }
  },
  "fixture_id": "synthetic_mb_pls_block_weighted_v1",
  "generator": {
    "git_revision_sha": "unknown",
    "name": "pls4all_parity.suites._mb_pls_expected",
    "params": {
      "algorithm": "mb_pls",
      "block_sizes": [
        2,
        3,
        2
      ],
      "n_components": 2,
      "reference": "Python block-autoscaled weighted MB-PLS using sklearn PLSRegression(scale=False)",
      "solver": "nipals"
    },
    "version": "1"
  },
  "schema_version": 1
}
