{
  "comparison_policy": {
    "components_alignment": "exact",
    "sign_resolver": "none",
    "tolerance_table_row": "pls4all-numpy-preprocessing"
  },
  "data": {
    "X": {
      "dtype": "f64",
      "layout": "row_major",
      "rng_seed": 49,
      "shape": [
        4,
        8
      ],
      "values": [
        1.1800000000000002,
        2.66204081632653,
        4.401020408163265,
        6.026938775510205,
        8.44979591836735,
        9.059591836734697,
        12.21632653061225,
        14.350000000000001,
        0.5349999999999999,
        1.542938775510204,
        2.7094693877551013,
        3.808591836734694,
        5.6183061224489785,
        6.018612244897959,
        8.446510204081633,
        10.028999999999996,
        2.1425,
        3.9275510204081634,
        5.990204081632653,
        7.9154591836734705,
        10.898316326530614,
        11.598775510204083,
        15.51433673469388,
        18.097499999999997,
        0.9700000000000001,
        1.830938775510204,
        2.7860408163265307,
        3.6713061224489802,
        5.178734693877552,
        5.468326530612247,
        7.478081632653064,
        8.726000000000003
      ]
    },
    "Y": {
      "dtype": "f64",
      "layout": "row_major",
      "rng_seed": 49,
      "shape": [
        4,
        1
      ],
      "values": [
        0.0,
        0.0,
        0.0,
        0.0
      ]
    }
  },
  "expected": {
    "transform_train": {
      "shape": [
        4,
        8
      ],
      "values": [
        1.2155523279016054,
        2.4688727264769503,
        3.9712808187552042,
        5.3806460299620085,
        7.538424638596462,
        8.031209076655651,
        10.890592063102297,
        12.815475889978387,
        1.2022168885781221,
        2.502674367942794,
        3.9718999315348604,
        5.342114951014905,
        7.535141430135439,
        8.039073651730227,
        10.926279516695665,
        12.79265283379656,
        1.2090438768856053,
        2.4853698453497794,
        3.971582980918897,
        5.361840677259506,
        7.536822246584803,
        8.035047435512295,
        10.90800956529056,
        12.804336943627119,
        1.1951760744460946,
        2.5205208797183296,
        3.9722268092553903,
        5.321771401875479,
        7.533407969394473,
        8.043225971723912,
        10.945121695157217,
        12.780602769857673
      ]
    }
  },
  "fixture_id": "synthetic_pipeline_emsc_v1",
  "generator": {
    "git_revision_sha": "unknown",
    "name": "pls4all_parity.suites._pipeline_expected",
    "params": {
      "operators": [
        "emsc_2"
      ],
      "reference": "NumPy/SciPy preprocessing pipeline"
    },
    "version": "1"
  },
  "schema_version": 1
}
