{
  "comparison_policy": {
    "components_alignment": "exact",
    "sign_resolver": "none",
    "tolerance_table_row": "pls4all-numpy-simpls-component-cv"
  },
  "data": {
    "X": {
      "dtype": "f64",
      "layout": "row_major",
      "rng_seed": 97,
      "shape": [
        18,
        6
      ],
      "values": [
        0.04420795456359408,
        -0.12459562299056774,
        0.6312855929978275,
        0.2927827397305904,
        -0.9,
        -0.05290623990416569,
        -1.077732436142798,
        -0.07018855204280594,
        -0.11008017902511152,
        -0.5313153170558571,
        -0.7941176470588236,
        -0.013474444926393478,
        -0.6904672818980242,
        0.8130512797507128,
        -0.9498883049313941,
        -0.6909470943058651,
        -0.6882352941176471,
        0.109898838123887,
        -0.8394000630827386,
        0.35827865403654896,
        0.6157384090766445,
        -0.08627688163469664,
        -0.5823529411764706,
        -0.0013109411476026965,
        -0.815720997129576,
        0.4294872156821572,
        -0.8027088866978606,
        -0.6984983947036592,
        -0.47647058823529415,
        0.018562488399567808,
        0.6200525280115683,
        -0.42314511483385936,
        0.07968395134457465,
        0.29266240632142204,
        -0.37058823529411766,
        -0.015815887165820778,
        -0.1859508447193677,
        -0.16907004159508976,
        0.21309946580473724,
        0.0038830658377514288,
        -0.26470588235294124,
        -0.03548757762620024,
        0.7321929781324605,
        0.2873900639294513,
        0.10619786218746946,
        0.3852902005139396,
        -0.1588235294117647,
        0.09899703351007871,
        -1.9020141324726498,
        0.6212570621389037,
        -0.008971955413110466,
        -0.8233925155782801,
        -0.05294117647058827,
        -0.0579179321440329,
        0.02772643049349971,
        -0.7555530419892141,
        -0.3351286379832747,
        -0.1685123737581001,
        0.05294117647058816,
        -0.03214261505830307,
        -0.2671593735169673,
        0.711482717981789,
        -1.251139689418927,
        -0.6398966205601677,
        0.1588235294117647,
        0.044217239035381814,
        0.6246321258916747,
        -0.6748254688091374,
        -0.2344614637696805,
        0.1451019777699188,
        0.26470588235294124,
        -0.053300839884653,
        -0.4237792773121699,
        -0.5917203105454332,
        0.3237000607852536,
        -0.0716194061784404,
        0.37058823529411755,
        0.04120943157120466,
        1.5581709826668575,
        -1.61840937081601,
        0.7043108975365437,
        0.933633115789337,
        0.4764705882352941,
        0.058319532692453914,
        -0.6574304342552869,
        -0.02085772818952525,
        1.0356535642789138,
        0.16344556205499697,
        0.5823529411764706,
        0.06995979718320654,
        -1.3847643166802253,
        1.6699314109360457,
        -1.3357734333273628,
        -1.1328273167068288,
        0.688235294117647,
        0.0025718453569586906,
        -1.1846675674013796,
        1.00792702892774,
        -0.21604304379000042,
        -0.5786016566396122,
        0.7941176470588235,
        -0.02390077823655774,
        -1.11324973297148,
        -0.05960462881463813,
        0.4444507359166752,
        -0.3019827684275578,
        0.9,
        0.01792087061834126
      ]
    },
    "Y": {
      "dtype": "f64",
      "layout": "row_major",
      "rng_seed": 97,
      "shape": [
        18,
        2
      ],
      "values": [
        -0.17303344338291674,
        -1.0105634918811532,
        -0.7883875796159711,
        0.26596288209951396,
        -0.8382337428396314,
        1.4564087574431333,
        -1.391866888884788,
        -0.9517637206184153,
        -0.6589877086165056,
        1.334803488225767,
        0.8964849348088142,
        -0.13227075765389926,
        -0.16163786672127106,
        -0.3108453234618371,
        0.20745678253319694,
        -0.33974513892410696,
        -2.1580091913582127,
        0.12187626605169861,
        0.8522491731277809,
        0.7333233003038516,
        -0.2658226946803798,
        1.9037113410648274,
        1.2404877695753176,
        0.4870233029471039,
        -0.08148078241292202,
        -0.35115886175302163,
        2.4501755566611654,
        -0.9922196255697949,
        -1.0695972777132847,
        -1.642688425083237,
        -2.047992270638813,
        1.946644856663501,
        -1.7377012623053245,
        0.3140964143892418,
        -1.1602520711361217,
        -0.5853800432805119
      ]
    }
  },
  "expected": {
    "best_n_components": {
      "dtype": "i32",
      "layout": "row_major",
      "shape": [
        1
      ],
      "values": [
        3
      ]
    },
    "metrics_by_component": {
      "dtype": "f64",
      "layout": "row_major",
      "shape": [
        3,
        9
      ],
      "values": [
        0.7592946022845325,
        0.6327769086594739,
        0.0016386880366084317,
        0.541718448702166,
        0.541718448702166,
        1.006995973403305,
        -0.0007486563021734949,
        1.4981353127327883,
        1.9893148121926543,
        0.7060078633404758,
        0.6153411393989897,
        0.40189529062924423,
        0.6037850797640194,
        0.6037850797640194,
        0.9931860645551057,
        -0.4000348407391201,
        1.6112087634090253,
        2.1394605890021317,
        0.23163803911128478,
        0.18760905421173243,
        0.05595990240486288,
        0.9573487750101581,
        0.9573487750101581,
        1.0662705327925202,
        -0.051128823168762966,
        4.9107912535184255,
        6.5208460792438325
      ]
    }
  },
  "fixture_id": "synthetic_component_cv_simpls_pls2_v1",
  "generator": {
    "git_revision_sha": "unknown",
    "name": "pls4all_parity.suites._component_cv_expected",
    "params": {
      "algorithm": "pls_regression",
      "n_components_max": 3,
      "n_splits": 3,
      "reference": "NumPy SIMPLS deterministic k-fold component-count CV",
      "solver": "simpls"
    },
    "version": "1"
  },
  "schema_version": 1
}
