{
  "comparison_policy": {
    "components_alignment": "exact",
    "sign_resolver": "none",
    "tolerance_table_row": "pls4all-numpy-preprocessing"
  },
  "data": {
    "X": {
      "dtype": "f64",
      "layout": "row_major",
      "rng_seed": 48,
      "shape": [
        3,
        9
      ],
      "values": [
        -1.9,
        -1.090625,
        -0.475,
        0.003125000000000022,
        0.4,
        0.7718750000000001,
        1.1749999999999998,
        1.665625,
        2.3,
        -1.0011436155469338,
        -0.44953350618957416,
        0.21532236239526867,
        0.7609631195052179,
        1.0,
        0.860963119505218,
        0.41532236239526865,
        -0.14953350618957412,
        -0.6011436155469336,
        -0.30000000000000004,
        -0.5499999999999999,
        -0.7,
        -0.7499999999999999,
        -0.7,
        -0.5499999999999999,
        -0.29999999999999993,
        0.050000000000000155,
        0.5000000000000001
      ]
    },
    "Y": {
      "dtype": "f64",
      "layout": "row_major",
      "rng_seed": 48,
      "shape": [
        3,
        1
      ],
      "values": [
        0.0,
        0.0,
        0.0
      ]
    }
  },
  "expected": {
    "transform_train": {
      "shape": [
        3,
        9
      ],
      "values": [
        0.3659374999999995,
        0.5231249999999997,
        0.569375,
        0.4600000000000001,
        0.4068750000000002,
        0.4100000000000003,
        0.46937500000000043,
        0.4181250000000006,
        0.28843750000000073,
        0.29845420652417626,
        0.47406794480465053,
        0.5212783856788661,
        0.3405670888994319,
        0.050000000000000336,
        -0.24056708889943132,
        -0.42127838567886583,
        -0.3940679448046507,
        -0.24845420652417666,
        -0.1050000000000001,
        -0.13000000000000017,
        -0.1000000000000002,
        -2.220446049250313e-16,
        0.09999999999999981,
        0.1999999999999999,
        0.3,
        0.29000000000000015,
        0.20500000000000018
      ]
    }
  },
  "fixture_id": "synthetic_pipeline_savgol_derivative_v1",
  "generator": {
    "git_revision_sha": "unknown",
    "name": "pls4all_parity.suites._pipeline_expected",
    "params": {
      "operators": [
        "savgol_derivative_5_2_1_1.0"
      ],
      "reference": "NumPy/SciPy preprocessing pipeline"
    },
    "version": "1"
  },
  "schema_version": 1
}
