{
  "comparison_policy": {
    "components_alignment": "exact",
    "sign_resolver": "none",
    "tolerance_table_row": "pls4all-numpy-preprocessing"
  },
  "data": {
    "X": {
      "dtype": "f64",
      "layout": "row_major",
      "rng_seed": 40,
      "shape": [
        4,
        3
      ],
      "values": [
        1.0,
        2.0,
        3.0,
        4.0,
        5.0,
        6.0,
        7.0,
        8.0,
        9.0,
        2.0,
        4.0,
        8.0
      ]
    },
    "Y": {
      "dtype": "f64",
      "layout": "row_major",
      "rng_seed": 40,
      "shape": [
        4,
        1
      ],
      "values": [
        0.0,
        0.0,
        0.0,
        0.0
      ]
    }
  },
  "expected": {
    "transform_train": {
      "shape": [
        4,
        3
      ],
      "values": [
        1.0,
        2.0,
        3.0,
        4.0,
        5.0,
        6.0,
        7.0,
        8.0,
        9.0,
        2.0,
        4.0,
        8.0
      ]
    }
  },
  "fixture_id": "synthetic_pipeline_identity_v1",
  "generator": {
    "git_revision_sha": "unknown",
    "name": "pls4all_parity.suites._pipeline_expected",
    "params": {
      "operators": [
        "identity"
      ],
      "reference": "NumPy/SciPy preprocessing pipeline"
    },
    "version": "1"
  },
  "schema_version": 1
}
